{
  "$schema": "./train_config.schema.json",
  "d_model": 128,
  "nhead": 4,
  "nlayers": 4,
  "ff_dim": 512,
  "static": true,
  "split_heads": true,
  "structured": true,
  "scratch_registers": 32,
  "prefetch": true,
  "compile": false,
  "log_interval": 10,
  "epochs": 10,
  "batch_size": 128,
  "accum_steps": 2,
  "lr": 0.0002457,
  "lr_schedule": "cosine",
  "warmup_steps": 1500,
  "lr_min_ratio": 0.2,
  "max_grad_norm": 1.0,
  "optimizer": "muon_adamw",
  "optimizer_state": "reset",
  "scheduler_state": "reset",
  "scheduler_total_steps": 0,
  "muon_momentum": 0.95,
  "muon_weight_decay": 0.01,
  "adamw_betas": [
    0.9,
    0.999
  ],
  "adamw_eps": 1e-8,
  "adamw_weight_decay": 0.01,
  "seed": 13,
  "slab_rows": 1024,
  "val_frac": 0.1,
  "val_batch_size": 128,
  "max_rows": 10000,
  "max_episodes": 2,
  "bc_workers": 1,
  "bc_flush": 1,
  "bc_ep_timeout": 60,
  "bc_would_ko": true,
  "bc_wk_nvar": 10,
  "bc_both_sides": true,
  "bc_self_aliases": [
    "FitaLabs",
    "Alef Oliveira"
  ],
  "value_atoms": 51,
  "value_vmax": 1.0,
  "tbptt_chunk": 32,
  "data_dir": "data/bc_data",
  "replay_zip_dir": "data/bc_replay_zip",
  "checkpoint_dir": "model/checkpoint",
  "model_dir": "model/bc_model",
  "checkpoint_every_epochs": 1
}
